{
  "schema_version": "1.0",
  "meeting_id": "2026-07-28-example-meeting",
  "change_id": "CHG-0001",
  "base_commit": "0000000",
  "candidate_commit": "0000000",
  "checks": [
    {
      "id": "artifact-template",
      "status": "blocked",
      "details": "Replace this template check with evidence from an executed iteration."
    }
  ],
  "changed_files": [],
  "changed_sections": [],
  "visual_review": {
    "status": "pending",
    "reviewer": null,
    "viewports": [
      "desktop",
      "mobile"
    ],
    "evidence": []
  },
  "failures": [],
  "disposition": "blocked"
}
